{
  "layer": "narrative_payload",
  "variant": "working",
  "meta": {
    "project": "读书/资源管理系统课程项目",
    "evidence_window": "2026-08-10 项目初始化至 2026-08-10 文档补全",
    "status": "未确认版，未经本人复核",
    "pending_questions": 0,
    "evidence_gaps": 0
  },
  "overview": {
    "text": "本项目是一个前后端分离的读书/资源管理系统，后端使用 Go 1.26 与 SQLite，前端使用 React 18 + TypeScript + Vite。README 记录了功能特性、目录结构、运行方式与接口说明。",
    "citations": [
      "evt-doc-08d307b1760355a1",
      "evt-doc-06e4fd3544e92d3e",
      "evt-doc-056f7a4b42fe59b0",
      "evt-doc-1410e7d7f320bab9"
    ]
  },
  "stages": [
    {
      "stage_id": "stage-1",
      "title": "项目初始化",
      "goal": "初始化 Git 仓库、添加 .gitignore 与 README 骨架。",
      "key_changes": [
        {
          "kind": "Added",
          "text": "初始化 Git 仓库、添加 .gitignore 与 README 骨架",
          "citations": [
            "evt-git-06f5aedf878836d2833895737a139c5b363d7f5a"
          ]
        }
      ],
      "citations": [
        "evt-git-06f5aedf878836d2833895737a139c5b363d7f5a"
      ]
    },
    {
      "stage_id": "stage-2",
      "title": "后端数据模型与 SQLite",
      "goal": "定义 books/categories 数据模型并完成 SQLite 初始化。",
      "key_changes": [
        {
          "kind": "Added",
          "text": "定义 books/categories 数据模型并完成 SQLite 初始化",
          "citations": [
            "evt-git-193ebd403a64a2827292e645de36d5f45392d403"
          ]
        }
      ],
      "citations": [
        "evt-git-193ebd403a64a2827292e645de36d5f45392d403"
      ]
    },
    {
      "stage_id": "stage-3",
      "title": "后端 REST API",
      "goal": "实现书籍/分类的 CRUD、搜索与分类筛选接口。",
      "key_changes": [
        {
          "kind": "Added",
          "text": "新增 backend/handlers.go 并实现 REST API",
          "citations": [
            "evt-git-e34539734543d9f7a0612bd1a9db987ab71e2b69"
          ]
        }
      ],
      "citations": [
        "evt-git-e34539734543d9f7a0612bd1a9db987ab71e2b69"
      ]
    },
    {
      "stage_id": "stage-4",
      "title": "前端脚手架与组件开发",
      "goal": "搭建 Vite + React + TS 前端，实现书籍列表、表单、详情与分类管理。",
      "key_changes": [
        {
          "kind": "Added",
          "text": "初始化 Vite + React + TS 脚手架，移除模板示例资源，并配置 /api 代理",
          "citations": [
            "evt-git-b61a8bf74e6959ab0af9e86439e5fa17d235fc08",
            "evt-git-0e23a31f58682494d2bf50cd000def053a1b44b3"
          ]
        },
        {
          "kind": "Added",
          "text": "实现前端类型定义、API 客户端、书籍列表/表单/详情/分类管理等组件",
          "citations": [
            "evt-git-45bb97e3215f3799c76d27fa1c3d89150a5b65ab",
            "evt-git-26af0db283e5ec8985860b5a3923acc124c34561",
            "evt-git-425f643c0b5ffaaf00f16cde3c5077f252760b1d",
            "evt-git-33e8a1150ff01b5513344c19cf4130bc334ff6ba"
          ]
        }
      ],
      "citations": [
        "evt-git-b61a8bf74e6959ab0af9e86439e5fa17d235fc08",
        "evt-git-0e23a31f58682494d2bf50cd000def053a1b44b3",
        "evt-git-45bb97e3215f3799c76d27fa1c3d89150a5b65ab",
        "evt-git-26af0db283e5ec8985860b5a3923acc124c34561",
        "evt-git-425f643c0b5ffaaf00f16cde3c5077f252760b1d",
        "evt-git-33e8a1150ff01b5513344c19cf4130bc334ff6ba"
      ]
    },
    {
      "stage_id": "stage-5",
      "title": "缺陷修复与文档补全",
      "goal": "修复新建书籍 created_at 默认值问题，并完善 README。",
      "key_changes": [
        {
          "kind": "Fixed",
          "text": "修复新建书籍 created_at 时间字段缺失默认值的问题",
          "citations": [
            "evt-git-3eac32114182bb9bca32ce8f13527d8ed04e45ae"
          ]
        }
      ],
      "citations": [
        "evt-git-3eac32114182bb9bca32ce8f13527d8ed04e45ae",
        "evt-git-40601e52098fdf155725f2fc5581844b2e4514ef"
      ]
    }
  ],
  "turning_points": [
    {
      "title": "新建书籍时间字段修复",
      "status": "confirmed",
      "body": "学生在确认中说明，修复前曾手动复现新增书籍接口返回 500 的问题，原因是 created_at 字段缺少默认值；随后给 model.go 中的 CreatedAt 添加了 time.Now() 默认值，并再次调用接口验证返回 200 与正确时间戳。",
      "citations": [
        "evt-git-3eac32114182bb9bca32ce8f13527d8ed04e45ae"
      ]
    }
  ],
  "ai_collaboration": {
    "coverage": "学生授权了一份 OpenCode 会话导出，采用最小保留级别：仅保留时间、工具类型、规范化相对路径、命令摘要与来源宿主。",
    "shape": "授权轨迹覆盖项目初始化和前后端文件写入阶段，未包含完整会话正文。",
    "focus": "轨迹中可见 bash、write 与 edit 工具操作集中在项目根目录、backend/ 与 frontend/src/。",
    "episodes": [
      {
        "label": "项目骨架搭建",
        "body": "最小保留记录显示，OpenCode 在会话早期执行了 git init、mkdir 等 bash 命令，并写入了 README.md 与 .gitignore，对应项目仓库和目录的建立。",
        "citations": [
          "evt-trace-595e56eee54cb4b4",
          "evt-trace-6cbecaa0576a7cd4",
          "evt-trace-58887592b76aa9bf"
        ],
        "derived": false
      },
      {
        "label": "后端模型与接口实现",
        "body": "最小保留记录显示，后端开发阶段写入了 backend/model.go，并编辑了 backend/handlers.go，对应数据模型定义与 REST 接口实现。",
        "citations": [
          "evt-trace-ed171df96f4fa898",
          "evt-trace-b729286dc0a2751b"
        ],
        "derived": false
      },
      {
        "label": "前端类型与组件开发",
        "body": "最小保留记录显示，前端开发阶段写入了 frontend/src/types.ts 等类型定义文件，并后续编辑了 App.tsx、BookList.tsx 等组件文件。",
        "citations": [
          "evt-trace-74804304a5963ff2"
        ],
        "derived": false
      }
    ],
    "boundary": "轨迹与 Git 提交不建立对应关系；任何因果或贡献归属均需学生本人确认。"
  },
  "verification": [
    "通过 learntrace verify-narrative 检查所有引用是否解析到 archive 中的 observable 事件。",
    "未发现测试日志，因此未对测试通过性做结论。"
  ],
  "reflection": {
    "status": "student_authored_only",
    "text": null
  },
  "takeaways": [],
  "evidence_gaps": []
}