{
  "layer": "narrative_payload",
  "variant": "submitted",
  "meta": {
    "project": "province-economy 课程项目",
    "evidence_window": "2026-08-10 项目初始化至 2026-08-21 最终清理",
    "status": "未确认版，未经本人复核",
    "pending_questions": 1,
    "evidence_gaps": 0
  },
  "overview": {
    "text": "本项目是一个面向中国省份经济数据的 Python 可视化分析系统，包含数据获取与清洗、模型分析、可视化、Web 服务、Docker 部署与 AI 问答助手等模块。README 与 data/README.md 记录了数据来源、目录结构与运行方式。",
    "citations": [
      "evt-doc-2dd4771a065f3084",
      "evt-doc-abae1ff1babb4652"
    ]
  },
  "stages": [
    {
      "stage_id": "stage-1",
      "title": "项目初始化与数据获取",
      "goal": "初始化仓库，添加数据获取、清洗模块及原始数据。",
      "key_changes": [
        {
          "kind": "Added",
          "text": "初始化项目仓库并添加数据获取、清洗模块及原始数据",
          "citations": [
            "evt-git-05ad6ea5590cb476cfb0ed6928ab6e84c289080f",
            "evt-git-46e915f3ce81ca7d577c865f57e7f8579cdd9b83"
          ]
        }
      ],
      "citations": [
        "evt-git-05ad6ea5590cb476cfb0ed6928ab6e84c289080f",
        "evt-git-46e915f3ce81ca7d577c865f57e7f8579cdd9b83"
      ]
    },
    {
      "stage_id": "stage-2",
      "title": "数据分析与模型实现",
      "goal": "实现算法分析模型并引入年份选择与缓存机制。",
      "key_changes": [
        {
          "kind": "Added",
          "text": "实现算法初步模型与完成单年份分析",
          "citations": [
            "evt-git-c7967dc39471e816636b4710b0b34368a96d9014",
            "evt-git-f859b8269f9db9f1ec41c8f68a7b4dc96d3d406e"
          ]
        },
        {
          "kind": "Changed",
          "text": "添加年份选择功能与缓存机制，精简 main.py",
          "citations": [
            "evt-git-3475a94efaa9a1479ec4f382485e6ae4fde6bd49"
          ]
        }
      ],
      "citations": [
        "evt-git-c7967dc39471e816636b4710b0b34368a96d9014",
        "evt-git-f859b8269f9db9f1ec41c8f68a7b4dc96d3d406e"
      ]
    },
    {
      "stage_id": "stage-3",
      "title": "数据合并与可视化",
      "goal": "合并数据分支，扩展数据覆盖范围，并添加可视化模块。",
      "key_changes": [
        {
          "kind": "Added",
          "text": "通过 Pull Request 合并 data 分支，扩展 2019-2024 年分省年度数据与指标表",
          "citations": [
            "evt-git-537af1d6cafab130a92ba68b20156e6e5af5dee8",
            "evt-git-94b12911c3ad5d5b0ceee2c9c59b3a509bfb53e2"
          ]
        },
        {
          "kind": "Added",
          "text": "添加可视化模块 api、choropleth、radar、ranking、trend 等",
          "citations": [
            "evt-git-5f3af1e6e7f35bc9e0eeb64c16fee6837c543e4b",
            "evt-git-3b6deda18796b74a43dac5c02dd4e767963abaaf",
            "evt-git-b20fb84c21879e95ed14ced7a495a0c9d8321cc3",
            "evt-git-cffc8a6f136823c6705e4cda86c3ebbe72ed6412",
            "evt-git-a74cc46b73717d635d0c884086365179899b655c"
          ]
        }
      ],
      "citations": [
        "evt-git-537af1d6cafab130a92ba68b20156e6e5af5dee8"
      ]
    },
    {
      "stage_id": "stage-4",
      "title": "服务化与 Docker 部署",
      "goal": "将分析能力封装为 Web 服务，并添加 Docker 编排支持。",
      "key_changes": [
        {
          "kind": "Added",
          "text": "提取 server 到 src/server/ 包并修复雷达图、添加年份切换",
          "citations": [
            "evt-git-78e35bf1bb13337179cb986395719f8f5b5844cf",
            "evt-git-9908fe98eb17374b3456bfa0d976e91106edd016"
          ]
        },
        {
          "kind": "Added",
          "text": "添加多阶段 Dockerfile、docker-compose 与部署文档",
          "citations": [
            "evt-git-6fa2a626925c3f277a4fca46f825ac8a03cbeeb1",
            "evt-git-c47046b50e56739f0f0ce1210146064e4ef5560e",
            "evt-git-21d6ae6d4d6303b6d3b38f2d80255232c6c8aa1f"
          ]
        }
      ],
      "citations": [
        "evt-git-6fa2a626925c3f277a4fca46f825ac8a03cbeeb1"
      ]
    },
    {
      "stage_id": "stage-5",
      "title": "AI 助手模块",
      "goal": "实现基于 RAG 与 Tool Calling 的 AI 智能助手，并接入 Docker 编排。",
      "key_changes": [
        {
          "kind": "Added",
          "text": "实现 AI 智能助手模块（RAG + Tool Calling + SSE 流式）",
          "citations": [
            "evt-git-15e9eac04bc038537f2da99135b0f013a6762e2a"
          ]
        },
        {
          "kind": "Changed",
          "text": "重构 Agent 模块迁移至 src/agent/ 并完成 Docker 编排",
          "citations": [
            "evt-git-1088dff3147d75eb174714156ff9f556ada1ea84",
            "evt-git-a76c6e52b158b518056e239b31a7ee993ebdba2f"
          ]
        }
      ],
      "citations": [
        "evt-git-15e9eac04bc038537f2da99135b0f013a6762e2a"
      ]
    },
    {
      "stage_id": "stage-6",
      "title": "最终整理",
      "goal": "完成 README 最终版并清理不必要文件。",
      "key_changes": [
        {
          "kind": "Changed",
          "text": "更新 README 最终版并清理不必要文件",
          "citations": [
            "evt-git-bfb85c6805c051ab412b6b57872f185e9f44ba8f",
            "evt-git-8a4b36c0d6c99fcb03781f5c40bce9722771a79b",
            "evt-git-01f5e21f84c6b02e3e4155f0ece44dcd07b8e18e"
          ]
        }
      ],
      "citations": [
        "evt-git-bfb85c6805c051ab412b6b57872f185e9f44ba8f"
      ]
    }
  ],
  "turning_points": [],
  "ai_collaboration": {
    "coverage": "学生授权了一份 OpenCode 会话导出，采用最小保留级别：仅保留时间、工具类型、规范化相对路径、命令摘要与来源宿主。",
    "shape": "授权轨迹覆盖项目初始化、服务化、Docker 部署与 AI 助手模块阶段，未包含完整会话正文。",
    "focus": "轨迹中可见 read、edit、write 与 bash 工具操作集中在 README.md、src/server/main.py、Dockerfile、docker-compose.yml、src/agent/agent.py 与 diagrams/ 等路径。",
    "episodes": [
      {
        "label": "项目初始化与文档阅读",
        "body": "最小保留记录显示，OpenCode 在会话早期读取了 README.md、src/config.py、pyproject.toml 与 .gitignore，并执行了 mkdir 命令，对应项目结构确认与目录准备。",
        "citations": [
          "evt-trace-1fbf5fb7d228e598",
          "evt-trace-843dc5685a988280",
          "evt-trace-35d5b7e7e1fc8983"
        ],
        "derived": false
      },
      {
        "label": "服务化与 Docker 部署",
        "body": "最小保留记录显示，服务化阶段读取并编辑了 src/server/main.py、Dockerfile、docker-compose.yml 与 nginx/default.conf，对应 Web 服务封装与容器化配置。",
        "citations": [
          "evt-trace-71f6638b1f3ea55b",
          "evt-trace-bf345b48c6359b84",
          "evt-trace-76de24a7ffdad9fe",
          "evt-trace-6d2a2d2bd9d0bdad",
          "evt-trace-9dfd0e19291757b6",
          "evt-trace-1990d7301bb27ae3"
        ],
        "derived": false
      },
      {
        "label": "架构图与 AI 助手",
        "body": "最小保留记录显示，Docker 与 AI 助手阶段写入了 diagrams/ 下的系统架构、数据流水线与 Docker 架构等 excalidraw 文件，并读取了 src/agent/agent.py。",
        "citations": [
          "evt-trace-c4a690a895e3d709",
          "evt-trace-557950c485b31337",
          "evt-trace-1f53ab055201ca3e",
          "evt-trace-7eb25783959f1b1b"
        ],
        "derived": false
      }
    ],
    "boundary": "轨迹与 Git 提交不建立对应关系；任何因果或贡献归属均需学生本人确认。"
  },
  "verification": [
    "通过 learntrace verify-narrative 检查所有引用是否解析到 archive 中的 observable 事件。",
    "未发现项目自身测试日志，因此未对测试通过性做结论。"
  ],
  "reflection": {
    "status": "student_authored_only",
    "text": "本次项目让我认识到，把数据分析脚本做成可复用的服务需要模块化和配置管理。最初 main.py 承担了所有职责，后来拆分为 data/、models/、visualization/、server/ 等包，并通过 Dockerfile 与 docker-compose.yml 实现了一键启动。最大的教训是数据缓存和模型下载路径需要显式管理，否则 Docker 镜像会过大或运行时报错。"
  },
  "takeaways": [
    "掌握了从国家统计局公开数据获取到清洗、分析的完整数据流水线设计。",
    "理解了将 Python 脚本分析升级为 Web 服务与 Docker 容器化部署的关键步骤。",
    "体会到在多人协作仓库中保持分支清晰、及时合并 PR 对项目推进的重要性。"
  ],
  "evidence_gaps": [],
  "intro_note": "本报告记录我在 province-economy 项目中的完整开发过程，包括数据流水线、可视化、服务化、Docker 部署与 AI 助手模块的迭代。",
  "ai_statement": "本项目开发过程中使用了 OpenCode 作为辅助工具。我仅授权导出了最小保留级别的工具操作记录，所有学习结论与反思由本人确认或亲自撰写。"
}